{
  "$schema": "urn:fortress:schema:v2:module-contract",
  "schema_version": 2,
  "id": "TEST-REPOSITORY-OBSERVATION-0001",
  "display_name": "Repository Observation Testing",
  "provides": [],
  "requires": [
    {
      "provider": "AF-CORE-0001",
      "capability": "CAP-FORTRESS-ENGINE",
      "version": "^0.1.0"
    },
    {
      "provider": "AF-REPOSITORY-OBSERVATION-0001",
      "capability": "CAP-REPOSITORY-OBSERVATION",
      "version": "^0.1.0"
    }
  ],
  "relationships": [
    {
      "type": "verifies",
      "target": "AF-REPOSITORY-OBSERVATION-0001",
      "subjects": [
        "AF-REPOSITORY-OBSERVATION-0001"
      ]
    }
  ],
  "constraints": [],
  "guarantees": [],
  "features": [],
  "behavior": []
}
