{
  "$schema": "urn:fortress:schema:v2:module-contract",
  "schema_version": 2,
  "id": "AF-ARCHITECTURE-EVALUATION-0001",
  "display_name": "Architecture Evaluation",
  "provides": [
    {
      "id": "CAP-ARCHITECTURE-EVALUATION",
      "version": "0.1.0",
      "visibility": "project"
    }
  ],
  "requires": [
    {
      "provider": "AF-CONTRACT-COHERENCY-0001",
      "capability": "CAP-CONTRACT-COHERENCY",
      "version": "^0.1.0"
    },
    {
      "provider": "AF-FINDING-MODEL-0001",
      "capability": "CAP-FINDING-MODEL",
      "version": "^0.1.0"
    },
    {
      "provider": "AF-IMPLEMENTATION-OBSERVATION-0001",
      "capability": "CAP-IMPLEMENTATION-OBSERVATION",
      "version": "^0.1.0"
    },
    {
      "provider": "AF-PROGRAM-SEMANTICS-0001",
      "capability": "CAP-PROGRAM-SEMANTICS",
      "version": "^0.1.0"
    },
    {
      "provider": "AF-PROJECT-MODEL-0001",
      "capability": "CAP-PROJECT-MODEL",
      "version": "^0.1.0"
    },
    {
      "provider": "AF-SEMANTIC-ANALYSIS-0001",
      "capability": "CAP-SEMANTIC-ANALYSIS",
      "version": "^0.1.0"
    },
    {
      "provider": "AF-STANDARD-REGISTRY-0001",
      "capability": "CAP-STANDARD-REGISTRY",
      "version": "^0.1.0"
    },
    {
      "provider": "AF-STATE-EFFECT-ANALYSIS-0001",
      "capability": "CAP-STATE-EFFECT-ANALYSIS",
      "version": "^0.1.0"
    }
  ],
  "relationships": [],
  "constraints": [],
  "guarantees": [],
  "features": [
    {
      "id": "AF-ARCHITECTURE-EVALUATION-0001",
      "version": "0.1.0",
      "requirements": [
        {
          "id": "AF-ARCHITECTURE-EVALUATION-0001-R01",
          "statement": "Architecture Evaluation consumes the canonical CCG Module and dependency facts to derive architecture and physical ownership views without owning or rebuilding contract resolution.",
          "tests": [
            "T-AF-ARCHITECTURE-EVALUATION-0001-R01-001"
          ]
        },
        {
          "id": "AF-ARCHITECTURE-EVALUATION-0001-R02",
          "statement": "The ARCH-DEPENDENCY-001 evaluator deterministically reports cycles in the Module graph derived from required capabilities.",
          "tests": [
            "T-AF-ARCHITECTURE-EVALUATION-0001-R02-001",
            "T-ARCH-DEPENDENCY-001-R01-001",
            "T-ARCH-DEPENDENCY-001-R01-002",
            "T-ARCH-DEPENDENCY-001-R01-003"
          ]
        },
        {
          "id": "AF-ARCHITECTURE-EVALUATION-0001-R03",
          "statement": "ARCH-REALIZATION-001 deterministically reconciles independently observed direct Rust Module dependencies with CCG direct authorization, hard-fails undeclared and transitive-bypass access, and keeps declared-unobserved, external, unresolved, unsupported, and capability-realization states truthful.",
          "tests": [
            "T-AF-ARCHITECTURE-EVALUATION-0001-R03-001",
            "T-ARCH-REALIZATION-001-R01-001",
            "T-ARCH-REALIZATION-001-R01-002",
            "T-ARCH-REALIZATION-001-R01-003",
            "T-ARCH-REALIZATION-001-R01-004"
          ]
        },
        {
          "id": "AF-ARCHITECTURE-EVALUATION-0001-R04",
          "statement": "Architecture Evaluation deterministically derives non-normative architecture diagnostics from canonical CCG containment and dependency facts plus independently observed realization while separating evidence-backed structural opportunities from rule violations.",
          "tests": [
            "T-AF-ARCHITECTURE-EVALUATION-0001-R04-001",
            "T-AF-ARCHITECTURE-EVALUATION-0001-R04-002",
            "T-AF-ARCHITECTURE-EVALUATION-0001-R04-003",
            "T-AF-ARCHITECTURE-EVALUATION-0001-R04-004",
            "T-AF-ARCHITECTURE-EVALUATION-0001-R04-005",
            "T-AF-ARCHITECTURE-EVALUATION-0001-R04-006"
          ]
        },
        {
          "id": "AF-ARCHITECTURE-EVALUATION-0001-R05",
          "statement": "Module Contract v3 declares explicit capability/effect allow and deny authority while v2 contracts remain loadable with semantic policy truthfully UNDECLARED.",
          "tests": [
            "T-AF-ARCHITECTURE-EVALUATION-0001-R05-001",
            "T-AF-ARCHITECTURE-EVALUATION-0001-R05-002"
          ]
        },
        {
          "id": "AF-ARCHITECTURE-EVALUATION-0001-R06",
          "statement": "ARCH-SEMANTIC-001 deterministically reconciles declared Module semantic policy with direct and transitive State/Effect evidence, represents relevant coverage, unresolved-operation, and provenance limits as canonical scoped defeaters, prevents defeated favorable conclusions without erasing proven violations, identifies each underlying violation from its stable operation site rather than coordinates or causal fan-in, excludes analysis-only territories, and scales by indexed Module ownership.",
          "tests": [
            "T-ARCH-SEMANTIC-001-R01-001",
            "T-ARCH-SEMANTIC-001-R01-002",
            "T-ARCH-SEMANTIC-001-R01-003",
            "T-ARCH-SEMANTIC-001-R01-004",
            "T-ARCH-SEMANTIC-001-R01-005",
            "T-ARCH-SEMANTIC-001-R01-006",
            "T-ARCH-SEMANTIC-001-R01-007",
            "T-ARCH-SEMANTIC-001-R01-008",
            "T-ARCH-SEMANTIC-001-R01-009",
            "T-ARCH-SEMANTIC-001-R01-010",
            "T-ARCH-SEMANTIC-001-R01-011",
            "T-ARCH-SEMANTIC-001-R01-012",
            "T-ARCH-SEMANTIC-001-R01-013"
          ]
        },
        {
          "id": "AF-ARCHITECTURE-EVALUATION-0001-R07",
          "statement": "Every Module semantic-policy claim carries exact governed-source and symbol-bearing-source coverage, and a DENY claim over governed source with zero semantic coverage remains UNKNOWN and NOT_EVALUABLE without weakening supported violations.",
          "tests": [
            "T-AF-ARCHITECTURE-EVALUATION-0001-R07-001",
            "T-AF-ARCHITECTURE-EVALUATION-0001-R07-002",
            "T-AF-ARCHITECTURE-EVALUATION-0001-R07-003",
            "T-AF-ARCHITECTURE-EVALUATION-0001-R07-004",
            "T-AF-ARCHITECTURE-EVALUATION-0001-R07-005"
          ]
        },
        {
          "id": "AF-ARCHITECTURE-EVALUATION-0001-R08",
          "statement": "Authored ALLOW semantic-policy entries remain AUTHORISED permissions with independent supported-usage counts and no conformance conclusion, while Module conformance aggregates only evaluative DENY claims.",
          "tests": [
            "T-AF-ARCHITECTURE-EVALUATION-0001-R08-001",
            "T-AF-ARCHITECTURE-EVALUATION-0001-R08-002",
            "T-AF-ARCHITECTURE-EVALUATION-0001-R08-003",
            "T-AF-ARCHITECTURE-EVALUATION-0001-R08-004"
          ]
        }
      ]
    }
  ],
  "behavior": [
    {
      "id": "CHK-ARCHITECTURE-EVALUATED",
      "feature": "AF-FORTRESS-AUDIT-0001",
      "kind": "action",
      "transitions": [
        {
          "target": "CHK-RULES-EVALUATED"
        }
      ]
    }
  ]
}
