{
  "$schema": "urn:fortress:schema:v2:module-contract",
  "schema_version": 2,
  "id": "AF-PROGRAM-SEMANTICS-0001",
  "display_name": "Program Semantics",
  "provides": [
    {
      "id": "CAP-PROGRAM-SEMANTICS",
      "version": "0.1.0",
      "visibility": "project"
    }
  ],
  "requires": [
    {
      "provider": "AF-CONTRACT-COHERENCY-0001",
      "capability": "CAP-CONTRACT-COHERENCY",
      "version": "^0.1.0"
    },
    {
      "provider": "AF-IMPLEMENTATION-OBSERVATION-0001",
      "capability": "CAP-IMPLEMENTATION-OBSERVATION",
      "version": "^0.1.0"
    },
    {
      "provider": "AF-PROJECT-MODEL-0001",
      "capability": "CAP-PROJECT-MODEL",
      "version": "^0.1.0"
    },
    {
      "provider": "AF-REPOSITORY-OBSERVATION-0001",
      "capability": "CAP-REPOSITORY-OBSERVATION",
      "version": "^0.1.0"
    },
    {
      "provider": "AF-STANDARD-REGISTRY-0001",
      "capability": "CAP-STANDARD-REGISTRY",
      "version": "^0.1.0"
    }
  ],
  "relationships": [],
  "constraints": [],
  "guarantees": [
    {
      "id": "GUA-PROGRAM-PREPARATION-EQUIVALENCE",
      "subject": {
        "kind": "capability",
        "id": "CAP-PROGRAM-SEMANTICS"
      },
      "requirements": [
        "AF-PROGRAM-SEMANTICS-0001-R09"
      ]
    }
  ],
  "features": [
    {
      "id": "AF-PROGRAM-SEMANTICS-0001",
      "version": "0.1.0",
      "requirements": [
        {
          "id": "AF-PROGRAM-SEMANTICS-0001-R01",
          "statement": "Program Semantics deterministically derives snapshot-bound Rust executable symbols and language-neutral typed interfaces with exact physical Fortress Module ownership, explicit semantic coverage, versioned structured symbol identity that excludes incidental source spelling, exact legacy aliases, and stable syntax-local operation-site identity.",
          "tests": [
            "T-AF-PROGRAM-SEMANTICS-0001-R01-001",
            "T-AF-PROGRAM-SEMANTICS-0001-R01-002",
            "T-AF-PROGRAM-SEMANTICS-0001-R01-003",
            "T-AF-PROGRAM-SEMANTICS-0001-R01-004",
            "T-AF-PROGRAM-SEMANTICS-0001-R01-005",
            "T-AF-PROGRAM-SEMANTICS-0001-R01-006",
            "T-AF-PROGRAM-SEMANTICS-0001-R01-007",
            "T-AF-PROGRAM-SEMANTICS-0001-R01-008"
          ]
        },
        {
          "id": "AF-PROGRAM-SEMANTICS-0001-R02",
          "statement": "Program Semantics conservatively resolves supported direct Rust calls, preserves every coverage state, and derives deterministic direct, transitive, recursive, cross-Module, and cross-package call topology without converting reachability into intent.",
          "tests": [
            "T-AF-PROGRAM-SEMANTICS-0001-R02-001",
            "T-AF-PROGRAM-SEMANTICS-0001-R02-002",
            "T-AF-PROGRAM-SEMANTICS-0001-R02-003"
          ]
        },
        {
          "id": "AF-PROGRAM-SEMANTICS-0001-R03",
          "statement": "Program Semantic analysis records bounded value-transfer facts, remains byte deterministic, rejects snapshot mutation, distinguishes authored Testing ownership from structurally established Rust execution provenance, conservatively recognizes test-only lexical and Cargo-target ancestry, and requires every resolved cross-Module call to agree with broader Implementation Observation evidence.",
          "tests": [
            "T-AF-PROGRAM-SEMANTICS-0001-R03-001",
            "T-AF-PROGRAM-SEMANTICS-0001-R03-002",
            "T-AF-PROGRAM-SEMANTICS-0001-R03-003",
            "T-AF-PROGRAM-SEMANTICS-0001-R03-004",
            "T-AF-PROGRAM-SEMANTICS-0001-R03-005",
            "T-AF-PROGRAM-SEMANTICS-0001-R03-006",
            "T-AF-PROGRAM-SEMANTICS-0001-R03-007"
          ]
        },
        {
          "id": "AF-PROGRAM-SEMANTICS-0001-R04",
          "statement": "Program Semantics translates supported Rust bodies into deterministic language-neutral statement, expression, pattern, branch, loop, return, and exceptional facts so downstream semantic reasoning consumes the PSM rather than reparsing source.",
          "tests": [
            "T-AF-PROGRAM-SEMANTICS-0001-R04-001"
          ]
        },
        {
          "id": "AF-PROGRAM-SEMANTICS-0001-R05",
          "statement": "Program Semantics deterministically indexes locally governed Rust structs, enums, traits, type aliases, fields, variants, and inherent or trait implementation blocks without changing executable symbol identities merely because the PSM schema evolves.",
          "tests": [
            "T-AF-PROGRAM-SEMANTICS-0001-R05-001",
            "T-AF-PROGRAM-SEMANTICS-0001-R05-002"
          ]
        },
        {
          "id": "AF-PROGRAM-SEMANTICS-0001-R06",
          "statement": "Program Semantics propagates a bounded local type lattice from explicit and registered exact return signatures, joins branches and loops conservatively, resolves fully qualified inherent and concrete trait method calls, emits canonical interprocedural transfers for newly resolved calls, and assigns stable semantic reasons or coverage barriers to every residual callback, destructor, async, macro, dereference, trait, and analyzer-limit boundary.",
          "tests": [
            "T-AF-PROGRAM-SEMANTICS-0001-R06-001",
            "T-AF-PROGRAM-SEMANTICS-0001-R06-002",
            "T-AF-PROGRAM-SEMANTICS-0001-R06-003",
            "T-AF-PROGRAM-SEMANTICS-0001-R06-004",
            "T-AF-PROGRAM-SEMANTICS-0001-R06-005",
            "T-AF-PROGRAM-SEMANTICS-0001-R06-006",
            "T-AF-PROGRAM-SEMANTICS-0001-R06-007",
            "T-AF-PROGRAM-SEMANTICS-0001-R06-008",
            "T-AF-PROGRAM-SEMANTICS-0001-R06-009",
            "T-AF-PROGRAM-SEMANTICS-0001-R06-010"
          ]
        },
        {
          "id": "AF-PROGRAM-SEMANTICS-0001-R07",
          "statement": "Program Semantics v3 emits deterministic structured binding, field, tuple-field, and dereference places plus direct state-read and mutation facts with exact resolution and provenance, without interpreting mutation safety.",
          "tests": [
            "T-AF-PROGRAM-SEMANTICS-0001-R07-001",
            "T-AF-PROGRAM-SEMANTICS-0001-R07-002"
          ]
        },
        {
          "id": "AF-PROGRAM-SEMANTICS-0001-R08",
          "statement": "Program Semantics records explicit package, target, feature and cfg knowledge in a machine-independent context, accounts for every enumerated call and unsupported implicit or macro operation, and distinguishes observed, opened, parsed and symbol-bearing source coverage without treating policy-only edits as program changes.",
          "tests": [
            "T-AF-PROGRAM-SEMANTICS-0001-R08-001",
            "T-AF-PROGRAM-SEMANTICS-0001-R08-002",
            "T-AF-PROGRAM-SEMANTICS-0001-R08-003",
            "T-AF-PROGRAM-SEMANTICS-0001-R08-004",
            "T-AF-PROGRAM-SEMANTICS-0001-R08-005",
            "T-AF-PROGRAM-SEMANTICS-0001-R08-006",
            "T-AF-PROGRAM-SEMANTICS-0001-R08-007",
            "T-AF-PROGRAM-SEMANTICS-0001-R08-008",
            "T-AF-PROGRAM-SEMANTICS-0001-R08-009",
            "T-AF-PROGRAM-SEMANTICS-0001-R08-010",
            "T-AF-PROGRAM-SEMANTICS-0001-R08-011",
            "T-AF-PROGRAM-SEMANTICS-0001-R08-012",
            "T-AF-PROGRAM-SEMANTICS-0001-R08-013"
          ]
        },
        {
          "id": "AF-PROGRAM-SEMANTICS-0001-R09",
          "statement": "Program Semantics prepares exact immutable inputs through the same canonical producer as cold compilation, keeps syntax and reusable declaration/body/caller/graph units coordinator-local, retains successful and missed dependency queries, rebuilds every body and caller in a changed source file for current provenance, reconstructs incomplete declaration/context/ownership/import/destructor dependencies conservatively, and exposes actual work without changing model bytes, identities, coverage, or typed error precedence.",
          "tests": [
            "T-AF-PROGRAM-SEMANTICS-0001-R09-001",
            "T-AF-PROGRAM-SEMANTICS-0001-R09-002",
            "T-AF-PROGRAM-SEMANTICS-0001-R09-003",
            "T-AF-PROGRAM-SEMANTICS-0001-R09-004",
            "T-AF-PROGRAM-SEMANTICS-0001-R09-005",
            "T-AF-PROGRAM-SEMANTICS-0001-R09-006",
            "T-AF-PROGRAM-SEMANTICS-0001-R09-007",
            "T-AF-PROGRAM-SEMANTICS-0001-R09-008"
          ]
        }
      ]
    }
  ],
  "behavior": []
}
