{
  "$schema": "urn:fortress:schema:v2:module-contract",
  "schema_version": 2,
  "id": "AF-REPOSITORY-OBSERVATION-0001",
  "display_name": "Repository Observation",
  "provides": [
    {
      "id": "CAP-REPOSITORY-OBSERVATION",
      "version": "0.1.0",
      "visibility": "project"
    }
  ],
  "requires": [
    {
      "provider": "AF-PROJECT-MODEL-0001",
      "capability": "CAP-PROJECT-MODEL",
      "version": "^0.1.0"
    }
  ],
  "relationships": [],
  "constraints": [],
  "guarantees": [
    {
      "id": "GUA-OBSERVATION-OPERATIONAL-BOUNDS",
      "subject": {
        "kind": "capability",
        "id": "CAP-REPOSITORY-OBSERVATION"
      },
      "requirements": [
        "AF-REPOSITORY-OBSERVATION-0001-R04"
      ]
    },
    {
      "id": "GUA-REPOSITORY-OBSERVATION-DETERMINISM",
      "subject": {
        "kind": "capability",
        "id": "CAP-REPOSITORY-OBSERVATION"
      },
      "requirements": [
        "AF-REPOSITORY-OBSERVATION-0001-R01",
        "AF-REPOSITORY-OBSERVATION-0001-R02",
        "AF-REPOSITORY-OBSERVATION-0001-R03"
      ]
    }
  ],
  "features": [
    {
      "id": "AF-REPOSITORY-OBSERVATION-0001",
      "version": "0.1.0",
      "requirements": [
        {
          "id": "AF-REPOSITORY-OBSERVATION-0001-R01",
          "statement": "Repository observation emits deterministic sorted repository-relative file facts with byte size and SHA-256 content identity.",
          "tests": [
            "T-AF-REPOSITORY-OBSERVATION-0001-R01-001",
            "T-AF-REPOSITORY-OBSERVATION-0001-R01-002",
            "T-AF-REPOSITORY-OBSERVATION-0001-R01-003"
          ]
        },
        {
          "id": "AF-REPOSITORY-OBSERVATION-0001-R02",
          "statement": "Observation rejects unsafe exclusion paths, applies explicit exclusions without converting observations into declarations, and observes active control-plane configuration from the filesystem regardless of Git ignore or tracking state.",
          "tests": [
            "T-AF-REPOSITORY-OBSERVATION-0001-R02-001",
            "T-AF-REPOSITORY-OBSERVATION-0001-R02-002",
            "T-AF-REPOSITORY-OBSERVATION-0001-R02-003",
            "T-AF-REPOSITORY-OBSERVATION-0001-R02-004"
          ]
        },
        {
          "id": "AF-REPOSITORY-OBSERVATION-0001-R03",
          "statement": "Repository Observation emits a portable manifest with explicit exclusions and bounded nonregular-entry limitations, and provides immutable exact-byte source views with conflict-checked hypothetical changes that remain distinct from actual observed state.",
          "tests": [
            "T-AF-REPOSITORY-OBSERVATION-0001-R03-001",
            "T-AF-REPOSITORY-OBSERVATION-0001-R03-002",
            "T-AF-REPOSITORY-OBSERVATION-0001-R03-003",
            "T-AF-REPOSITORY-OBSERVATION-0001-R03-004",
            "T-AF-REPOSITORY-OBSERVATION-0001-R03-005"
          ]
        },
        {
          "id": "AF-REPOSITORY-OBSERVATION-0001-R04",
          "statement": "Repository Observation offers caller-supplied operational limits on ordinary files, total traversed entries including directories, source bytes and path bytes, rejects over-budget metadata before hashing or whole-input allocation, and returns the same canonical observation as ordinary discovery when inputs fit. Its neutral resident-enabled retained-input helper admits bytes before tokenization, records exact input counters, prevents active-budget reset and retains sticky exhaustion without acquiring language, policy, job or publication authority. Ordinary unbounded observation and inactive helper behavior preserve their existing semantics.",
          "tests": [
            "T-AF-REPOSITORY-OBSERVATION-0001-R04-001",
            "T-AF-REPOSITORY-OBSERVATION-0001-R04-002",
            "T-AF-REPOSITORY-OBSERVATION-0001-R04-003"
          ]
        }
      ]
    }
  ],
  "behavior": []
}
