{
  "$schema": "urn:fortress:schema:v2:module-contract",
  "schema_version": 2,
  "id": "AF-PROJECT-MODEL-0001",
  "display_name": "Project Model",
  "provides": [
    {
      "id": "CAP-PROJECT-MODEL",
      "version": "0.1.0",
      "visibility": "project"
    }
  ],
  "requires": [
    {
      "provider": "AF-STANDARD-REGISTRY-0001",
      "capability": "CAP-STANDARD-REGISTRY",
      "version": "^0.1.0"
    }
  ],
  "relationships": [],
  "constraints": [],
  "guarantees": [
    {
      "id": "GUA-PROJECT-FILING-SYSTEM",
      "subject": {
        "kind": "capability",
        "id": "CAP-PROJECT-MODEL"
      },
      "requirements": [
        "AF-PROJECT-MODEL-0001-R04"
      ]
    }
  ],
  "features": [
    {
      "id": "AF-PROJECT-MODEL-0001",
      "version": "0.1.0",
      "requirements": [
        {
          "id": "AF-PROJECT-MODEL-0001-R01",
          "statement": "The core loads schema-versioned operational project configuration and rejects invalid, duplicate, or unsafe repository observation exclusions.",
          "tests": [
            "T-AF-PROJECT-MODEL-0001-R01-001",
            "T-AF-PROJECT-MODEL-0001-R01-002",
            "T-AF-PROJECT-MODEL-0001-R02-001",
            "T-AF-PROJECT-MODEL-0001-R02-002",
            "T-AF-PROJECT-MODEL-0001-R02-003"
          ]
        },
        {
          "id": "AF-PROJECT-MODEL-0001-R03",
          "statement": "The temporal change schema represents ordinary changes without requiring bootstrap-only packet provenance.",
          "tests": [
            "T-AF-PROJECT-MODEL-0001-R03-001"
          ]
        },
        {
          "id": "AF-PROJECT-MODEL-0001-R04",
          "statement": "The Project Model uses one authoritative index to deterministically represent every directly nested lowercase snake_case canonical Module, present reserved Element, bounded Data/Info role and collection, scoped or opaque registered ecosystem structure, and complete leaf-file inventory while rejecting malformed Module attempts and filesystem levels without recognized structural meaning and keeping leaf inventory out of the CCG.",
          "tests": [
            "T-AF-PROJECT-MODEL-0001-R04-001",
            "T-AF-PROJECT-MODEL-0001-R04-002",
            "T-AF-PROJECT-MODEL-0001-R04-003",
            "T-AF-PROJECT-MODEL-0001-R04-004",
            "T-AF-PROJECT-MODEL-0001-R04-005",
            "T-AF-PROJECT-MODEL-0001-R04-006",
            "T-AF-PROJECT-MODEL-0001-R04-007",
            "T-AF-PROJECT-MODEL-0001-R04-008",
            "T-AF-PROJECT-MODEL-0001-R04-009",
            "T-AF-PROJECT-MODEL-0001-R04-010",
            "T-AF-PROJECT-MODEL-0001-R04-011",
            "T-AF-PROJECT-MODEL-0001-R04-012",
            "T-AF-PROJECT-MODEL-0001-R04-013",
            "T-AF-PROJECT-MODEL-0001-R04-014",
            "T-AF-PROJECT-MODEL-0001-R04-015",
            "T-AF-PROJECT-MODEL-0001-R04-016"
          ]
        },
        {
          "id": "AF-PROJECT-MODEL-0001-R05",
          "statement": "The Project Model binds exact selected Standard, project, ownership, profile and governance identities to a machine-independent evaluation key with separate source-manifest and program-context components.",
          "tests": [
            "T-AF-PROJECT-MODEL-0001-R05-001"
          ]
        }
      ]
    }
  ],
  "behavior": []
}
