{
  "$schema": "urn:fortress:schema:v2:module-contract",
  "schema_version": 2,
  "id": "TEST-SOURCE-ARCHITECTURE-0001",
  "display_name": "Source Architecture Testing",
  "provides": [],
  "requires": [
    {
      "provider": "AF-CORE-0001",
      "capability": "CAP-FORTRESS-ENGINE",
      "version": "^0.1.0"
    },
    {
      "provider": "AF-SOURCE-ARCHITECTURE-0001",
      "capability": "CAP-SOURCE-ARCHITECTURE",
      "version": "^0.1.0"
    }
  ],
  "relationships": [
    {
      "type": "verifies",
      "target": "AF-SOURCE-ARCHITECTURE-0001",
      "subjects": [
        "AF-SOURCE-ARCHITECTURE-0001"
      ]
    }
  ],
  "constraints": [],
  "guarantees": [],
  "features": [],
  "behavior": []
}
