{
  "$schema": "urn:fortress:schema:v2:module-contract",
  "schema_version": 2,
  "id": "AF-CORE-0001",
  "display_name": "Engine",
  "provides": [
    {
      "id": "CAP-FORTRESS-ENGINE",
      "version": "0.1.0",
      "visibility": "public"
    }
  ],
  "requires": [
    {
      "provider": "AF-ARCHITECTURE-EVALUATION-0001",
      "capability": "CAP-ARCHITECTURE-EVALUATION",
      "version": "^0.1.0"
    },
    {
      "provider": "AF-BEHAVIORAL-SEMANTICS-0001",
      "capability": "CAP-BEHAVIORAL-SEMANTICS",
      "version": "^0.1.0"
    },
    {
      "provider": "AF-CONTRACT-COHERENCY-0001",
      "capability": "CAP-CONTRACT-COHERENCY",
      "version": "^0.1.0"
    },
    {
      "provider": "AF-FINDING-MODEL-0001",
      "capability": "CAP-FINDING-MODEL",
      "version": "^0.1.0"
    },
    {
      "provider": "AF-IMPLEMENTATION-OBSERVATION-0001",
      "capability": "CAP-IMPLEMENTATION-OBSERVATION",
      "version": "^0.1.0"
    },
    {
      "provider": "AF-PROGRAM-SEMANTICS-0001",
      "capability": "CAP-PROGRAM-SEMANTICS",
      "version": "^0.1.0"
    },
    {
      "provider": "AF-PROJECT-MODEL-0001",
      "capability": "CAP-PROJECT-MODEL",
      "version": "^0.1.0"
    },
    {
      "provider": "AF-REPOSITORY-OBSERVATION-0001",
      "capability": "CAP-REPOSITORY-OBSERVATION",
      "version": "^0.1.0"
    },
    {
      "provider": "AF-SEMANTIC-ANALYSIS-0001",
      "capability": "CAP-SEMANTIC-ANALYSIS",
      "version": "^0.1.0"
    },
    {
      "provider": "AF-SNAPSHOT-GOVERNANCE-0001",
      "capability": "CAP-SNAPSHOT-GOVERNANCE",
      "version": "^0.1.0"
    },
    {
      "provider": "AF-STANDARD-REGISTRY-0001",
      "capability": "CAP-STANDARD-REGISTRY",
      "version": "^0.1.0"
    },
    {
      "provider": "AF-STATE-EFFECT-ANALYSIS-0001",
      "capability": "CAP-STATE-EFFECT-ANALYSIS",
      "version": "^0.1.0"
    }
  ],
  "relationships": [],
  "constraints": [],
  "guarantees": [],
  "features": [],
  "behavior": []
}
