{
  "$schema": "urn:fortress:schema:v2:module-contract",
  "schema_version": 2,
  "id": "AF-STATE-EFFECT-ANALYSIS-0001",
  "display_name": "State and Effect Analysis",
  "provides": [
    {
      "id": "CAP-STATE-EFFECT-ANALYSIS",
      "version": "0.1.0",
      "visibility": "project"
    }
  ],
  "requires": [
    {
      "provider": "AF-FINDING-MODEL-0001",
      "capability": "CAP-FINDING-MODEL",
      "version": "^0.1.0"
    },
    {
      "provider": "AF-PROGRAM-SEMANTICS-0001",
      "capability": "CAP-PROGRAM-SEMANTICS",
      "version": "^0.1.0"
    },
    {
      "provider": "AF-SEMANTIC-ANALYSIS-0001",
      "capability": "CAP-SEMANTIC-ANALYSIS",
      "version": "^0.1.0"
    }
  ],
  "relationships": [],
  "constraints": [],
  "guarantees": [],
  "features": [
    {
      "id": "AF-STATE-EFFECT-ANALYSIS-0001",
      "version": "0.1.0",
      "requirements": [
        {
          "id": "AF-STATE-EFFECT-ANALYSIS-0001-R01",
          "statement": "State and Effect Analysis validates canonical distributed State Contract v1 and Function Contract v3/v4 state/effect authority against PSM nominal ownership, fields, symbols, and Semantic Analysis domains.",
          "tests": [
            "T-AF-STATE-EFFECT-ANALYSIS-0001-R01-001",
            "T-AF-STATE-EFFECT-ANALYSIS-0001-R01-002",
            "T-AF-STATE-EFFECT-ANALYSIS-0001-R01-003",
            "T-AF-STATE-EFFECT-ANALYSIS-0001-R01-004",
            "T-AF-STATE-EFFECT-ANALYSIS-0001-R01-005",
            "T-AF-STATE-EFFECT-ANALYSIS-0001-R01-006"
          ]
        },
        {
          "id": "AF-STATE-EFFECT-ANALYSIS-0001-R02",
          "statement": "State and Effect Analysis conservatively classifies exact, possible, unclassified, and unknown typestates and composes supported receiver transitions through resolved calls without treating opaque aliases as unchanged.",
          "tests": [
            "T-AF-STATE-EFFECT-ANALYSIS-0001-R02-001",
            "T-AF-STATE-EFFECT-ANALYSIS-0001-R02-002",
            "T-AF-STATE-EFFECT-ANALYSIS-0001-R02-003",
            "T-AF-STATE-EFFECT-ANALYSIS-0001-R02-004",
            "T-AF-STATE-EFFECT-ANALYSIS-0001-R02-005",
            "T-AF-STATE-EFFECT-ANALYSIS-0001-R02-006"
          ]
        },
        {
          "id": "AF-STATE-EFFECT-ANALYSIS-0001-R03",
          "statement": "State and Effect Analysis derives direct and SCC-aware transitive effects with causal provenance and rejects only supported state precondition, state postcondition, and authored effect-policy contradictions.",
          "tests": [
            "T-AF-STATE-EFFECT-ANALYSIS-0001-R03-001",
            "T-AF-STATE-EFFECT-ANALYSIS-0001-R03-002",
            "T-AF-STATE-EFFECT-ANALYSIS-0001-R03-003",
            "T-AF-STATE-EFFECT-ANALYSIS-0001-R03-004",
            "T-AF-STATE-EFFECT-ANALYSIS-0001-R03-005",
            "T-AF-STATE-EFFECT-ANALYSIS-0001-R03-006",
            "T-AF-STATE-EFFECT-ANALYSIS-0001-R03-007"
          ]
        },
        {
          "id": "AF-STATE-EFFECT-ANALYSIS-0001-R04",
          "statement": "State and Effect Analysis emits deterministic canonical derived Info and PROGRAM-STATE-001 and PROGRAM-EFFECT-001 findings while preserving property-specific coverage and unsupported semantics.",
          "tests": [
            "T-AF-STATE-EFFECT-ANALYSIS-0001-R04-001",
            "T-AF-STATE-EFFECT-ANALYSIS-0001-R04-002",
            "T-AF-STATE-EFFECT-ANALYSIS-0001-R04-003"
          ]
        },
        {
          "id": "AF-STATE-EFFECT-ANALYSIS-0001-R05",
          "statement": "State and Effect Analysis classifies exact semantic operation identities into a structured effect ontology and capability consequences, preserves unsupported operation coverage, detects supported Rust panic and unsafe boundaries, propagates causal evidence with entry and direct-origin execution provenance, and retains explicit Function Contract v3 umbrella compatibility without weakening v4 distinctions.",
          "tests": [
            "T-AF-STATE-EFFECT-ANALYSIS-0001-R05-001",
            "T-AF-STATE-EFFECT-ANALYSIS-0001-R05-002",
            "T-AF-STATE-EFFECT-ANALYSIS-0001-R05-003",
            "T-AF-STATE-EFFECT-ANALYSIS-0001-R05-004",
            "T-AF-STATE-EFFECT-ANALYSIS-0001-R05-005",
            "T-AF-STATE-EFFECT-ANALYSIS-0001-R05-006",
            "T-AF-STATE-EFFECT-ANALYSIS-0001-R05-007"
          ]
        }
      ]
    }
  ],
  "behavior": []
}
